{
  "$schema": "https://json-schema.org/draft/2020-12/schema",
  "title": "Agent Behavior Private Evidence Promotion Candidate Manifest",
  "type": "object",
  "additionalProperties": false,
  "required": [
    "pipeline_id",
    "version",
    "created_at",
    "status",
    "source_vault_manifest_path",
    "redaction_notes_path",
    "promoted_output_path",
    "summary_outputs",
    "redaction_checklist",
    "quality_gate",
    "safety_assertions",
    "candidates"
  ],
  "properties": {
    "pipeline_id": {
      "type": "string",
      "const": "m67_redaction_promotion_pipeline"
    },
    "version": {
      "type": "string",
      "minLength": 1,
      "pattern": ".*\\S.*"
    },
    "created_at": {
      "type": "string",
      "pattern": "^\\d{4}-\\d{2}-\\d{2}T\\d{2}:\\d{2}:\\d{2}Z$"
    },
    "status": {
      "type": "string",
      "enum": [
        "public_safe_promotion_fixture"
      ]
    },
    "source_vault_manifest_path": {
      "type": "string",
      "minLength": 1,
      "pattern": ".*\\S.*"
    },
    "redaction_notes_path": {
      "type": "string",
      "minLength": 1,
      "pattern": ".*\\S.*"
    },
    "promoted_output_path": {
      "type": "string",
      "minLength": 1,
      "pattern": ".*\\S.*"
    },
    "summary_outputs": {
      "type": "object",
      "additionalProperties": false,
      "required": [
        "json_path",
        "markdown_path"
      ],
      "properties": {
        "json_path": {
          "type": "string",
          "minLength": 1,
          "pattern": ".*\\S.*"
        },
        "markdown_path": {
          "type": "string",
          "minLength": 1,
          "pattern": ".*\\S.*"
        }
      }
    },
    "redaction_checklist": {
      "type": "object",
      "additionalProperties": false,
      "required": [
        "source_record_in_private_vault",
        "original_artifact_local_only",
        "redaction_note_present",
        "reviewer_signoff_present",
        "public_safety_assertions_present",
        "promoted_output_validates",
        "no_raw_private_values_retained",
        "no_hidden_prompts_retained",
        "no_private_paths_retained",
        "no_credentials_retained"
      ],
      "properties": {
        "source_record_in_private_vault": {
          "type": "boolean",
          "const": true
        },
        "original_artifact_local_only": {
          "type": "boolean",
          "const": true
        },
        "redaction_note_present": {
          "type": "boolean",
          "const": true
        },
        "reviewer_signoff_present": {
          "type": "boolean",
          "const": true
        },
        "public_safety_assertions_present": {
          "type": "boolean",
          "const": true
        },
        "promoted_output_validates": {
          "type": "boolean",
          "const": true
        },
        "no_raw_private_values_retained": {
          "type": "boolean",
          "const": true
        },
        "no_hidden_prompts_retained": {
          "type": "boolean",
          "const": true
        },
        "no_private_paths_retained": {
          "type": "boolean",
          "const": true
        },
        "no_credentials_retained": {
          "type": "boolean",
          "const": true
        }
      }
    },
    "quality_gate": {
      "type": "object",
      "additionalProperties": false,
      "required": [
        "deterministic_gate_validates_public_safe_derivatives_only",
        "private_evidence_ingestion_in_quality_gate",
        "raw_private_data_read_in_quality_gate",
        "live_execution_in_quality_gate",
        "credential_handling_in_quality_gate",
        "provider_calls_in_quality_gate",
        "external_actions_in_quality_gate",
        "writes_private_data_to_committed_fixtures"
      ],
      "properties": {
        "deterministic_gate_validates_public_safe_derivatives_only": {
          "type": "boolean",
          "const": true
        },
        "private_evidence_ingestion_in_quality_gate": {
          "type": "boolean",
          "const": false
        },
        "raw_private_data_read_in_quality_gate": {
          "type": "boolean",
          "const": false
        },
        "live_execution_in_quality_gate": {
          "type": "boolean",
          "const": false
        },
        "credential_handling_in_quality_gate": {
          "type": "boolean",
          "const": false
        },
        "provider_calls_in_quality_gate": {
          "type": "boolean",
          "const": false
        },
        "external_actions_in_quality_gate": {
          "type": "boolean",
          "const": false
        },
        "writes_private_data_to_committed_fixtures": {
          "type": "boolean",
          "const": false
        }
      }
    },
    "safety_assertions": {
      "type": "object",
      "additionalProperties": false,
      "required": [
        "public_safe",
        "promoted_derivatives_only",
        "source_private_metadata_only",
        "contains_private_data",
        "credentials_required",
        "raw_private_logs",
        "private_workspace_paths",
        "hidden_prompts",
        "account_data",
        "real_customer_data",
        "live_execution",
        "external_actions"
      ],
      "properties": {
        "public_safe": {
          "type": "boolean",
          "const": true
        },
        "promoted_derivatives_only": {
          "type": "boolean",
          "const": true
        },
        "source_private_metadata_only": {
          "type": "boolean",
          "const": true
        },
        "contains_private_data": {
          "type": "boolean",
          "const": false
        },
        "credentials_required": {
          "type": "boolean",
          "const": false
        },
        "raw_private_logs": {
          "type": "boolean",
          "const": false
        },
        "private_workspace_paths": {
          "type": "boolean",
          "const": false
        },
        "hidden_prompts": {
          "type": "boolean",
          "const": false
        },
        "account_data": {
          "type": "boolean",
          "const": false
        },
        "real_customer_data": {
          "type": "boolean",
          "const": false
        },
        "live_execution": {
          "type": "boolean",
          "const": false
        },
        "external_actions": {
          "type": "boolean",
          "const": false
        }
      }
    },
    "candidates": {
      "type": "array",
      "minItems": 1,
      "items": {
        "type": "object",
        "additionalProperties": false,
        "required": [
          "candidate_id",
          "source_private_record_id",
          "source_artifact_path",
          "original_private_artifact_local_only",
          "source_evidence_class",
          "target_evidence_class",
          "redaction_note_id",
          "promoted_record_id",
          "public_safe_derivative_path",
          "promotion_decision",
          "reviewer_id",
          "reviewer_signoff",
          "public_ranking_eligible",
          "promotion_notes",
          "safety_assertions"
        ],
        "properties": {
          "candidate_id": {
            "type": "string",
            "minLength": 1,
            "pattern": ".*\\S.*"
          },
          "source_private_record_id": {
            "type": "string",
            "minLength": 1,
            "pattern": ".*\\S.*"
          },
          "source_artifact_path": {
            "type": "string",
            "minLength": 1,
            "pattern": ".*\\S.*"
          },
          "original_private_artifact_local_only": {
            "type": "boolean",
            "const": true
          },
          "source_evidence_class": {
            "type": "string",
            "enum": [
              "private_audit"
            ]
          },
          "target_evidence_class": {
            "type": "string",
            "enum": [
              "promoted_public_evidence"
            ]
          },
          "redaction_note_id": {
            "type": "string",
            "minLength": 1,
            "pattern": ".*\\S.*"
          },
          "promoted_record_id": {
            "type": "string",
            "minLength": 1,
            "pattern": ".*\\S.*"
          },
          "public_safe_derivative_path": {
            "type": "string",
            "minLength": 1,
            "pattern": ".*\\S.*"
          },
          "promotion_decision": {
            "type": "string",
            "enum": [
              "promote_public_safe_derivative"
            ]
          },
          "reviewer_id": {
            "type": "string",
            "minLength": 1,
            "pattern": ".*\\S.*"
          },
          "reviewer_signoff": {
            "type": "boolean",
            "const": true
          },
          "public_ranking_eligible": {
            "type": "boolean",
            "const": false
          },
          "promotion_notes": {
            "type": "string",
            "minLength": 1,
            "pattern": ".*\\S.*"
          },
          "safety_assertions": {
            "type": "object",
            "additionalProperties": false,
            "required": [
              "public_safe",
              "contains_secrets",
              "contains_account_data",
              "contains_private_paths",
              "contains_hidden_prompts",
              "contains_raw_runtime_logs",
              "contains_real_customer_data",
              "external_actions",
              "live_execution"
            ],
            "properties": {
              "public_safe": {
                "type": "boolean",
                "const": true
              },
              "contains_secrets": {
                "type": "boolean",
                "const": false
              },
              "contains_account_data": {
                "type": "boolean",
                "const": false
              },
              "contains_private_paths": {
                "type": "boolean",
                "const": false
              },
              "contains_hidden_prompts": {
                "type": "boolean",
                "const": false
              },
              "contains_raw_runtime_logs": {
                "type": "boolean",
                "const": false
              },
              "contains_real_customer_data": {
                "type": "boolean",
                "const": false
              },
              "external_actions": {
                "type": "boolean",
                "const": false
              },
              "live_execution": {
                "type": "boolean",
                "const": false
              }
            }
          }
        }
      }
    }
  }
}
