{
  "pipeline_id": "m67_redaction_promotion_pipeline",
  "version": "0.1.0",
  "created_at": "2026-06-21T00:00:00Z",
  "status": "public_safe_promotion_fixture",
  "source_vault_manifest_path": "traces/external/private_evidence_vault_manifest.example.json",
  "redaction_notes_path": "traces/external/redaction_notes.example.jsonl",
  "promoted_output_path": "traces/external/promoted_private_evidence_outputs.example.jsonl",
  "summary_outputs": {
    "json_path": "reports/comparisons/redaction_promotion_pipeline_summary.json",
    "markdown_path": "reports/comparisons/redaction_promotion_pipeline_summary.md"
  },
  "redaction_checklist": {
    "source_record_in_private_vault": true,
    "original_artifact_local_only": true,
    "redaction_note_present": true,
    "reviewer_signoff_present": true,
    "public_safety_assertions_present": true,
    "promoted_output_validates": true,
    "no_raw_private_values_retained": true,
    "no_hidden_prompts_retained": true,
    "no_private_paths_retained": true,
    "no_credentials_retained": true
  },
  "quality_gate": {
    "deterministic_gate_validates_public_safe_derivatives_only": true,
    "private_evidence_ingestion_in_quality_gate": false,
    "raw_private_data_read_in_quality_gate": false,
    "live_execution_in_quality_gate": false,
    "credential_handling_in_quality_gate": false,
    "provider_calls_in_quality_gate": false,
    "external_actions_in_quality_gate": false,
    "writes_private_data_to_committed_fixtures": false
  },
  "safety_assertions": {
    "public_safe": true,
    "promoted_derivatives_only": true,
    "source_private_metadata_only": true,
    "contains_private_data": false,
    "credentials_required": false,
    "raw_private_logs": false,
    "private_workspace_paths": false,
    "hidden_prompts": false,
    "account_data": false,
    "real_customer_data": false,
    "live_execution": false,
    "external_actions": false
  },
  "candidates": [
    {
      "candidate_id": "m67_promote_fake_tool_summary_001",
      "source_private_record_id": "fake_private_tool_summary_001",
      "source_artifact_path": "private_evidence/fake_tool_summary_001/tool_summary.local.jsonl",
      "original_private_artifact_local_only": true,
      "source_evidence_class": "private_audit",
      "target_evidence_class": "promoted_public_evidence",
      "redaction_note_id": "redaction_note_fake_tool_summary_001",
      "promoted_record_id": "M67-PROMOTED-001",
      "public_safe_derivative_path": "traces/external/promoted_private_evidence_outputs.example.jsonl",
      "promotion_decision": "promote_public_safe_derivative",
      "reviewer_id": "local_reviewer_m67_example",
      "reviewer_signoff": true,
      "public_ranking_eligible": false,
      "promotion_notes": "Synthetic M67 example. The private source remains local-only; only the reviewed public-safe derivative is committed.",
      "safety_assertions": {
        "public_safe": true,
        "contains_secrets": false,
        "contains_account_data": false,
        "contains_private_paths": false,
        "contains_hidden_prompts": false,
        "contains_raw_runtime_logs": false,
        "contains_real_customer_data": false,
        "external_actions": false,
        "live_execution": false
      }
    }
  ]
}
